mastery_id,value,description1,-1,"NY (Not yet): I really do not get anything at all, but I am trying different things I know"2,0,N (No attempt): I did not attempt anything at all3,1,1 : Struggle with what facts apply to the problem and doubt myself when trying to follow R procedures4,2,"2: Recall necessary facts, follow procedures, and sometimes explain the concepts. Struggle with R and NR procedures"5,3,"3: Recall necessary facts, follow procedures, explain concepts, apply procedures to R problems, and not NR problems"6,4,"4: Recall necessary facts, follow procedures, explain concepts, apply procedures to routine and non-routine problems, accurately justify my decision-making"